{
  "version": 1,
  "basics": { "locale": "en_US.UTF-8", "keyboardLayout": "us", "timezone": "UTC" },
  "profile": "headless",
  "hardware": { "firmware": "bios" },
  "disk": { "device": "/dev/vdb", "filesystem": "ext4", "encryption": false, "swapGib": 1 },
  "users": [{ "name": "ada", "admin": true }],
  "hostname": "thinkpad"
}
