{
  "version": 1,
  "basics": {
    "locale": "en_US.UTF-8",
    "keyboardLayout": "us",
    "timezone": "UTC"
  },
  "desktop": {
    "id": "icewm"
  },
  "apps": {
    "packages": [
      "xterm"
    ]
  },
  "keybinds": {
    "SUPER + F11": {
      "action": "xterm"
    },
    "SUPER + F10": {
      "action": "KeyWinClose"
    },
    "CTRL + ALT + B": "unbind",
    "SUPER + F9": {
      "exec": "touch /tmp/kb-added"
    }
  },
  "disk": {
    "device": "/dev/vdb",
    "filesystem": "ext4"
  },
  "users": [
    {
      "name": "kim",
      "admin": true
    }
  ],
  "hostname": "keys"
}
